{
  "countdowns": [
    {
      "name": "プロジェクト締切",
      "targetDate": "2025-03-31",
      "enabled": true,
      "message": "プロジェクト締切まであと{days}日です"
    }
  ],
  "yearlyTasks": [
    {
      "name": "サービス開始記念日",
      "month": 4,
      "day": 1,
      "enabled": true,
      "message": "今日はサービス開始記念日です🎉"
    },
    {
      "name": "年次システムメンテナンス",
      "month": 12,
      "day": 28,
      "enabled": true
    }
  ],
  "monthlyTasks": [
    {
      "name": "家賃振込",
      "day": 25,
      "enabled": true
    },
    {
      "name": "月次レポート提出",
      "day": 31,
      "enabled": true,
      "message": "今月の月次レポート提出日です📊"
    }
  ],
  "weeklyTasks": [
    {
      "name": "可燃ごみ",
      "dayOfWeek": [2, 5],
      "enabled": true,
      "message": "今日は可燃ごみの日です🗑️"
    },
    {
      "name": "チームミーティング",
      "dayOfWeek": [1],
      "enabled": true,
      "message": "今日はチームミーティングの日です👥"
    }
  ],
  "specificWeekTasks": [
    {
      "name": "資源ごみ",
      "week": 2,
      "dayOfWeek": 3,
      "enabled": true,
      "message": "今日は資源ごみの日です♻️"
    },
    {
      "name": "第1月曜定例会",
      "week": 1,
      "dayOfWeek": 1,
      "enabled": true
    }
  ],
  "lastWeekTasks": [
    {
      "name": "経費精算",
      "dayOfWeek": 5,
      "enabled": true,
      "message": "今月最後の金曜日です。経費精算を忘れずに💰"
    }
  ]
}